{"event_id":"11111111-1111-4111-8111-111111111120","event_type":"access.revoke.request.v1.dlq","schema_version":1,"occurred_at":"2026-07-19T12:00:00Z","producer":"provisioning-service","correlation_id":"11111111-1111-4111-8111-111111111120","aggregate_type":"consumer_record","aggregate_id":"11111111-1111-4111-8111-111111111120","partition_key":"source:access.revoke.request.v1","data":{"source_topic":"access.revoke.request.v1","source_partition":1,"source_offset":43,"payload_sha256":"bbbbbbbbbbbbbbbbbbbbbbbbbbbbbbbbbbbbbbbbbbbbbbbbbbbbbbbbbbbbbbbb","reason_code":"invalid_event_data"}}
